<?xml version="1.0" encoding="UTF-8" standalone="yes"?>
<petShop xmlns:xsi="http://www.w3.org/2001/XMLSchema-instance"
 xsi:noNamespaceSchemaLocation="petshop.xsd" name="Animals Care, S.A.">
	<reptiles>
 		<reptile>Boa constrictor
			<weight measurementUnit="Kg">65</weight>
			<length measurementUnit="cm">230</length>
			<age measurementUnit="months">14</age>
		</reptile>
		<reptile>Iguana
			<weight measurementUnit="Kg">2</weight>
			<length measurementUnit="mm">500</length>
		</reptile>
	</reptiles>
	<mammals>
 		<mammal code="ABC-(12345)">
			<name value="Toby"/>
			<specie>
				<dog/>
			</specie>
			<description>A beautiful dog</description>
		</mammal>
		<mammal code="ZYX-(98765)">
			<name value="Willy"/>
			<specie>
				<whale/>
			</specie>
			<description>It's funny</description>
		</mammal>
		<mammal code="GHI-(55567)">
			<name value="Flipper"/>
			<specie>
				<dolphin/>
			</specie>
			<description>A cute animal</description>
		</mammal>
	</mammals>
	<measurementUnits>mm cm dm m kg days weeks months</measurementUnits>
	<contactInfo>
		<postalAddress>Rúa da Angustia, 12</postalAddress>
		<telephone>637123985</telephone>
	</contactInfo>
	<clients>  
		<client name="Tamara Xordo Roi">
			<postalAddress>Rúa da Paz, 33, 3º-D - 15702 - Compostela</postalAddress>
			<telephone>621465767</telephone>
			<email>tamaraxr@gmail.com</email>
		</client> 
	</clients>
</petShop>